{
  "schema_version": "2.0.0",
  "status_vocabulary": "stp-v1.1-status-axes",
  "capability_policy_ref": "governance/ledger/policy/capabilities.v2.json",
  "event_id": "evt_semantics_status_vocabulary_boundary_0001",
  "stream_id": "semantics",
  "sequence": 1,
  "event_type": "semantics.status_vocabulary_observed",
  "occurred_at": "2026-08-11T22:44:11Z",
  "recorded_at": "2026-08-11T22:44:11Z",
  "actor": {
    "id": "github:JakeTOpenSource",
    "role": "repository_owner",
    "auth_basis": "governance/decision-log/0003-stp-status-vocabulary-boundary.md"
  },
  "classification": "PUBLIC",
  "consequence_class": "C2",
  "parents": [
    "evt_governance_public_metadata_release_0002"
  ],
  "prev_event_hash": "",
  "payload_hash": "a2f25f6dbc6da56187155cb6c0dcdbb5f2fc00149be78d5a0585aa9c2efd9b6a",
  "event_hash": "cca5be5a16d815990fd23a1006d731e9704e9db16bbeacb76bedc0e45916ff96",
  "read_set": [
    "governance/decision-log/0003-stp-status-vocabulary-boundary.md",
    "governance/ledger/schemas/event.v1.schema.json",
    "governance/ledger/schemas/event.v2.schema.json"
  ],
  "write_set": [
    "governance/status-vocabulary-contract.json"
  ],
  "precondition_refs": [
    "evt_governance_public_metadata_release_0002",
    "governance/decision-log/0003-stp-status-vocabulary-boundary.md"
  ],
  "evidence_refs": [
    {
      "ref_id": "state-transition-protocol-v1.1-status-table",
      "kind": "public_research_artifact",
      "classification": "PUBLIC",
      "sha256": "48aad2ce2f660f32c4af54547c189168bec722053a8e06b25946624ad2f30bf2",
      "source_locator": "State Transition Protocol v1.1, page 8"
    },
    {
      "ref_id": "legacy-event-schema-v1",
      "kind": "repository_schema",
      "classification": "PUBLIC",
      "sha256": "4476b4dbba37c445d4fd7ae4f975f9e1e99a6dd70ce773d60c0d7bc717a910ae",
      "source_locator": "governance/ledger/schemas/event.v1.schema.json"
    },
    {
      "ref_id": "status-vocabulary-decision-0003",
      "kind": "decision_record",
      "classification": "PUBLIC",
      "sha256": "c3a193bd7bfcf180d0a6b6fa7de4dd26e375ce4c2e98b0bc90056728b08d5648",
      "source_locator": "governance/decision-log/0003-stp-status-vocabulary-boundary.md"
    }
  ],
  "authority_ref": "governance/decision-log/0003-stp-status-vocabulary-boundary.md",
  "idempotency_key": "semantics:status-vocabulary-boundary:2026-08-11:0001",
  "decision": "DEFER",
  "status_axes": {
    "evidence": "SUPPORTED",
    "authority": "APPROVED",
    "preparation": "READY",
    "execution": "APPLIED",
    "observation": "MISMATCHED",
    "acceptance": "PRESERVED",
    "outcome": "UNMEASURED"
  },
  "effect": {
    "kind": "NONE",
    "target": null,
    "reversible": true,
    "recovery_ref": null
  },
  "supersedes": [],
  "correction_of": [],
  "payload": {
    "claim_ceiling": "Pins literal status vocabularies and records an unresolved relation; it does not define missing semantics, aliases, or conformance.",
    "projection": {
      "path": "governance/status-vocabulary-contract.json",
      "record": {
        "schema_version": "0.1.0",
        "record_id": "delta-atlas-status-vocabulary-contract-2026-08-11",
        "recorded_at": "2026-08-11T22:44:11Z",
        "decision": "DEFER",
        "decision_ref": "governance/decision-log/0003-stp-status-vocabulary-boundary.md",
        "canonical_source": {
          "artifact_id": "state-transition-protocol-v1.1-pdf",
          "page": 8,
          "sha256": "48aad2ce2f660f32c4af54547c189168bec722053a8e06b25946624ad2f30bf2"
        },
        "vocabularies": {
          "delta-atlas-legacy-adapter-v1": {
            "status": "FROZEN_LEGACY",
            "schema_ref": "governance/ledger/schemas/event.v1.schema.json",
            "relationship_to_stp_v1_1": "UNKNOWN",
            "axes": {
              "evidence": ["VERIFIED", "UNVERIFIED", "NOT_OBSERVED", "NOT_APPLICABLE"],
              "authority": ["AUTHORIZED", "UNVERIFIED", "NOT_REQUIRED", "NOT_OBSERVED"],
              "preparation": ["PASS", "FAIL", "UNKNOWN", "NOT_APPLICABLE"],
              "execution": ["PASS", "FAIL", "NOT_EXECUTED", "UNKNOWN", "NOT_APPLICABLE"],
              "observation": ["OBSERVED", "FAIL", "NOT_OBSERVED", "UNKNOWN", "NOT_APPLICABLE"],
              "acceptance": ["ACCEPT", "ACCEPT_WITH_LIMITS", "DEFER", "REJECT", "NOT_APPLICABLE"],
              "outcome": ["PASS", "FAIL", "UNKNOWN", "NOT_OBSERVED", "NOT_APPLICABLE"]
            }
          },
          "stp-v1.1-status-axes": {
            "status": "LITERAL_TOKENS_PINNED_SEMANTICS_INCOMPLETE",
            "schema_ref": "governance/ledger/schemas/event.v2.schema.json",
            "axes": {
              "evidence": ["SUPPORTED", "CONTRADICTED", "UNRESOLVED", "UNAVAILABLE", "INVALID"],
              "authority": ["APPROVED", "DENIED", "DEFERRED", "ESCALATED", "REVOKED", "NOT_REQUIRED"],
              "preparation": ["READY", "BLOCKED", "STALE", "CONFLICT", "EXPIRED"],
              "execution": ["NOT_ATTEMPTED", "APPLIED", "PARTIAL", "FAILED", "REVERSED"],
              "observation": ["MATCHED", "MISMATCHED", "UNAVAILABLE", "INVALID"],
              "acceptance": ["ACCEPTED", "PRESERVED", "PROVISIONAL", "CONTESTED", "SUPERSEDED", "EXPIRED"],
              "outcome": ["MET", "NOT_MET", "MIXED", "TOO_EARLY", "UNMEASURED"]
            }
          }
        },
        "relations": [
          {
            "from": "delta-atlas-legacy-adapter-v1",
            "to": "stp-v1.1-status-axes",
            "relation": "UNKNOWN",
            "reason": "Axis names overlap, but values and their missing state-transition semantics have not been proven equivalent."
          },
          {
            "from": "calibration-ledger-v8-attached-docx",
            "to": "stp-v1.1-status-axes",
            "relation": "UNKNOWN",
            "reason": "The attached candidate is not the artifact pinned by STP v1.1 and no supersession or migration has been accepted."
          }
        ],
        "constraints": [
          "Every displayed status is qualified by axis and vocabulary.",
          "No PASS-like coercion is permitted across vocabularies.",
          "Literal token identity does not prove semantic completeness or conformance.",
          "ALIAS requires scoped behavioral and signature equivalence evidence."
        ],
        "open_gaps": [
          "Status entry and exit predicates are undefined in STP v1.1.",
          "Allowed transitions, precedence, terminality, and simultaneous-axis constraints are undefined.",
          "The exact Calibration Ledger artifact pinned by STP v1.1 remains unresolved."
        ]
      }
    }
  }
}
